{
  "$schema": "https://json-schema.org/draft/2020-12/schema",
  "$id": "https://kurone-kito.github.io/idd-skill/schemas/post-idd-marker.schema.json",
  "title": "Post IDD Marker Result",
  "description": "Dry-run body preview or apply result for POSTing a canonical IDD operational marker comment to an issue or PR.",
  "type": "object",
  "required": ["mode", "type", "target", "number"],
  "properties": {
    "mode": {
      "type": "string",
      "enum": ["dry-run", "apply"],
      "description": "Whether the helper previewed a marker or posted it."
    },
    "type": {
      "type": "string",
      "enum": [
        "claim",
        "unclaim",
        "activation-nonce",
        "watermark",
        "baseline",
        "advisory",
        "advisory-recovery",
        "advisory-reroll",
        "review-ack",
        "copilot-unavailable",
        "idd-hold",
        "authoring-owner",
        "authoring-publication-intent"
      ],
      "description": "Operational marker type rendered for the comment."
    },
    "target": {
      "type": "string",
      "enum": ["issue", "pr"],
      "description": "GitHub object kind receiving the marker comment."
    },
    "number": {
      "type": "integer",
      "minimum": 1,
      "description": "Issue or pull request number receiving the marker."
    },
    "body": {
      "type": "string",
      "description": "Byte-exact marker body that dry-run would post; omitted in apply mode."
    },
    "commentId": {
      "type": "integer",
      "minimum": 1,
      "description": "Identifier of the comment created in apply mode."
    },
    "url": {
      "type": "string",
      "description": "URL of the comment created in apply mode."
    },
    "warnings": {
      "type": "array",
      "description": "Non-blocking diagnostics reported while preparing or posting the marker.",
      "items": {
        "type": "string"
      }
    },
    "operationLocal": {
      "type": "object",
      "description": "Present for --operation-local. watermarkFields describe snapshot from the same capture. A saved snapshot is not an input.",
      "additionalProperties": false,
      "required": [
        "decision",
        "reason",
        "snapshot",
        "watermarkFields",
        "warnings"
      ],
      "properties": {
        "decision": {
          "type": "string",
          "enum": ["publish", "defer", "refuse"],
          "description": "Whether this capture may publish a watermark, defer it because CI is incomplete (required checks not passing, or with none configured the present runs not all passing), or refuse it."
        },
        "reason": {
          "type": ["string", "null"],
          "description": "Human-readable refusal or deferral text. Null when decision is publish."
        },
        "snapshot": {
          "description": "The review-activity snapshot collected in this operation. Watermark fields are derived from this object."
        },
        "watermarkFields": {
          "type": "object",
          "additionalProperties": { "type": "string" },
          "description": "Watermark field strings derived from snapshot. Always an object: a capture whose derivation fails throws before any envelope is printed."
        },
        "warnings": {
          "type": "array",
          "items": { "type": "string" },
          "description": "Disposition warnings for this same capture. They do not by themselves publish or suppress the marker. A same-head-activity refusal appends one entry naming the review-body findings that have no thread."
        }
      }
    }
  },
  "additionalProperties": false
}
